{
  "$schema": "https://json-schema.org/draft/2020-12/schema",
  "title": "Lab 001 run record (schema v1.2.0)",
  "type": "object",
  "required": [
    "run_id",
    "task_id",
    "condition",
    "workload",
    "repetition",
    "model",
    "provider",
    "model_version",
    "model_calls",
    "tool_calls",
    "input_tokens",
    "output_tokens",
    "total_tokens",
    "cost",
    "pricing_snapshot_id",
    "latency_ms",
    "retries",
    "escalations",
    "cache_state",
    "task_success",
    "quality_score",
    "environment_id",
    "raw_evidence_path",
    "methodology_version",
    "run_class",
    "token_source",
    "quality_judged_before_cost",
    "outcome"
  ],
  "properties": {
    "run_id": {
      "type": "string"
    },
    "attempt_id": {
      "type": [
        "string",
        "null"
      ],
      "description": "R3-01. WHICH PLANNED ATTEMPT this record is, issued by the run plan. Distinct from run_id, which identifies the EXECUTION and changes on every retry. The aggregator checks this against the frozen plan; a record without one lands in a cell that cannot be reported."
    },
    "task_id": {
      "type": "string"
    },
    "condition": {
      "enum": [
        "C0",
        "C1",
        "C2",
        "C3",
        "C4",
        "C5",
        "C2+C4",
        "C3+C4",
        "CALIB",
        "CACHE"
      ]
    },
    "workload": {
      "enum": [
        "A",
        "B",
        "C",
        "D",
        "E"
      ]
    },
    "repetition": {
      "type": "integer",
      "minimum": 1
    },
    "model": {
      "type": "string"
    },
    "provider": {
      "type": "string"
    },
    "model_version": {
      "type": "string"
    },
    "model_pair": {
      "type": [
        "string",
        "null"
      ],
      "description": "REQUIRED for C4. Tier-adjacent pair."
    },
    "model_calls": {
      "type": "integer"
    },
    "tool_calls": {
      "type": "integer"
    },
    "input_tokens": {
      "type": "integer"
    },
    "output_tokens": {
      "type": "integer"
    },
    "total_tokens": {
      "type": "integer"
    },
    "tool_schema_tokens": {
      "type": [
        "integer",
        "null"
      ]
    },
    "tool_result_tokens": {
      "type": [
        "integer",
        "null"
      ]
    },
    "token_source": {
      "enum": [
        "provider_usage_field",
        "atk_meter"
      ],
      "description": "bytes/4 and other uncalibrated estimators are PROHIBITED as ground truth"
    },
    "cost": {
      "type": "number"
    },
    "pricing_snapshot_id": {
      "type": "string"
    },
    "latency_ms": {
      "type": "integer"
    },
    "retries": {
      "type": "integer"
    },
    "escalations": {
      "type": "integer"
    },
    "cache_state": {
      "enum": [
        "cold",
        "warm",
        "unknown"
      ],
      "description": "'unknown' voids the run - methodology v1.0.0 section 9"
    },
    "task_success": {
      "type": "boolean"
    },
    "quality_score": {
      "type": "number",
      "minimum": 0,
      "maximum": 1
    },
    "quality_judged_before_cost": {
      "type": "boolean"
    },
    "failure_reason": {
      "type": [
        "string",
        "null"
      ]
    },
    "pending_adjudication": {
      "type": "boolean",
      "description": "ADV-D. The scorer found a possible constraint violation that structural detection cannot decide. The attempt may legitimately be PASS; its CELL is not reportable until the Red Team rules on it."
    },
    "environment_id": {
      "type": "string"
    },
    "container_digest": {
      "type": [
        "string",
        "null"
      ]
    },
    "candidate_commit_sha": {
      "type": [
        "string",
        "null"
      ]
    },
    "prompt_hash": {
      "type": [
        "string",
        "null"
      ]
    },
    "config_hash": {
      "type": [
        "string",
        "null"
      ]
    },
    "task_version": {
      "type": [
        "string",
        "null"
      ]
    },
    "raw_evidence_path": {
      "type": "string"
    },
    "methodology_version": {
      "enum": [
        "1.0.0",
        "1.1.0"
      ],
      "description": "v1.1.0 section 13: the scorer and runner refuse a record whose version they do not implement. Silent cross-version scoring is how a v1.0.0 relative floor would survive into a v1.1.0 result."
    },
    "egress_destinations": {
      "type": "array",
      "items": {
        "type": "string"
      }
    },
    "run_class": {
      "enum": [
        "benchmark",
        "pilot",
        "calibration",
        "reproduction",
        "dry_run"
      ],
      "description": "benchmark = an official LG4 run. pilot = a Calibration Pilot run. calibration = a meter calibration run. reproduction = an independent repeat. dry_run = offline plumbing verification with NO model in the loop; a dry_run record may never be reported as a benchmark result or used to support any hypothesis."
    },
    "blind_treatment_id": {
      "type": [
        "string",
        "null"
      ]
    },
    "reproduces_run_id": {
      "type": [
        "string",
        "null"
      ]
    },
    "task_set_hash": {
      "type": [
        "string",
        "null"
      ]
    },
    "answer_key_hash": {
      "type": [
        "string",
        "null"
      ]
    },
    "notes": {
      "type": [
        "string",
        "null"
      ]
    },
    "image_content_sha256": {
      "type": [
        "string",
        "null"
      ],
      "description": "Computed INSIDE the running container over the harness and fixed payload. Unlike container_digest, which is an operator-supplied string, this cannot be forged by a command-line flag."
    },
    "dependency_manifest_sha256": {
      "type": [
        "string",
        "null"
      ]
    },
    "outcome": {
      "enum": [
        "PASS",
        "FAIL_QUALITY",
        "INVALID"
      ],
      "description": "METHODOLOGY v1.1.0 section 6.2. PASS = scored and met the floor. FAIL_QUALITY = scored and missed it, or breached a zero-tolerance criterion. INVALID = could not be scored at all: missing or empty required evidence, tool-chain failure, unpriceable usage, undeterminable cache state. INVALID is not a success and is not deleted; it stays in the denominator. 'It failed' and 'we could not measure it' are different findings and must not share a value."
    },
    "corpus_modified": {
      "type": [
        "array",
        "null"
      ],
      "items": {
        "type": "string"
      },
      "description": "RT-08: corpus paths whose hash changed during the attempt. Non-empty fails the attempt outright."
    },
    "required_evidence_fields": {
      "type": [
        "array",
        "null"
      ],
      "items": {
        "type": "string"
      },
      "description": "Which evidence fields the Evidence Producer supplied for this attempt."
    },
    "evidence_provenance": {
      "type": [
        "object",
        "null"
      ],
      "description": "How each evidence field was derived. Static facts from the frozen corpus, dynamic facts from the runner audit; never from the model's own output."
    },
    "unpriceable_quantities": {
      "type": [
        "array",
        "null"
      ],
      "items": {
        "type": "string"
      },
      "description": "METHODOLOGY v1.1.0 section 11.4: billable quantities the pricing snapshot cannot price. Non-empty means the attempt's cost is not established and the harness does NOT estimate."
    },
    "turn_count": {
      "type": [
        "integer",
        "null"
      ]
    },
    "early_stop": {
      "type": [
        "boolean",
        "null"
      ],
      "description": "The run ended before the declared turn count. Recorded honestly; missing turns are never fabricated."
    },
    "scorer_hash": {
      "type": [
        "string",
        "null"
      ],
      "description": "sha256 of judge.py, the scorer that produced this record's quality figures. Named in the evidence manifest and previously present in no record (D-7)."
    },
    "run_config_hash": {
      "type": [
        "string",
        "null"
      ],
      "description": "The RUN configuration hash - condition, pricing snapshot, task set. A DIFFERENT quantity from the manifest's config_hash, which covers the schema and harness modules (D-8)."
    }
  },
  "additionalProperties": false,
  "description": "Schema v1.1.0. Changes from v1.0.0, all additive or tightening: run_class is new and required, so an offline plumbing dry-run can never be mistaken for a benchmark result; token_source and quality_judged_before_cost move from optional to required, because an omitted token_source leaves no way to tell a provider-reported count from an estimate; blind_treatment_id, reproduces_run_id, task_set_hash and answer_key_hash are added for the blind-evaluation and reproduction protocols. methodology_version stays pinned at 1.0.0 - the frozen methodology is untouched."
}
