{
  "answer_key_hash": "ef02357796fdcd57008e59eed61f1b17577d471968e60b2750df43667a1c000f",
  "blind_treatment_id": "Treatment J",
  "cache_state": "cold",
  "condition": "C1",
  "config_hash": "6e64eac1dcfbbc005f2ca0d2f977c7d28fed7d3976c9886999a5194ff8250a3e",
  "container_digest": "sha256:pending-final",
  "corpus_modified": null,
  "cost": 0.009890175,
  "dependency_manifest_sha256": "8273d0e2144011927245abc2e701f009306fbf92166df665195fe6fbf031f0a9",
  "environment_id": "lab001-env-2026-09-16",
  "escalations": 0,
  "evidence_provenance": {
    "corpus_access_log": "corpus reads observed in the runner's audit. Never the model's claim to have read something - A-001's anti-shortcut guard depends on this being observed.",
    "corpus_hashes_after": "the same files, re-hashed after the attempt; a difference fails it",
    "corpus_hashes_before": "sha256 of every corpus file, taken before the attempt ran",
    "tool_calls": "server-written audit at /lab/dryrun/TOOL_AUDIT.jsonl, filtered to run dry_run-A-002-C1-r1; 3 entr(ies) attributed to this attempt",
    "valid_symbols": "ast parse of module-level defs under /lab/tasks/corpora/repo_ledgerline/ledgerline"
  },
  "failure_reason": "unparseable_output",
  "image_content_sha256": "88ece1882d1c7ef629c404fe3f1bade4f93eff55b47cbb22a6bd0ccaa70be5b2",
  "input_tokens": 74677,
  "latency_ms": 0,
  "methodology_version": "1.1.0",
  "model": "deepseek-flash",
  "model_calls": 3,
  "model_version": "deepseek-flash-2026-09",
  "notes": null,
  "outcome": "FAIL_QUALITY",
  "output_tokens": 2794,
  "pricing_snapshot_id": "PS-2026-09-16",
  "prompt_hash": "7f5188db208d610933600a46cb03adeb201ac324ca8d5253e067dbfb2355db43",
  "provider": "deepseek",
  "quality_judged_before_cost": true,
  "quality_score": 0.0,
  "raw_evidence_path": "/lab/dryrun/out/raw/dry_run-A-002-C1-r1",
  "repetition": 1,
  "reproduces_run_id": null,
  "required_evidence_fields": [
    "corpus_access_log",
    "corpus_hashes",
    "corpus_hashes_after",
    "corpus_hashes_before",
    "tool_calls",
    "valid_symbols"
  ],
  "retries": 0,
  "run_class": "dry_run",
  "run_config_hash": "6e64eac1dcfbbc005f2ca0d2f977c7d28fed7d3976c9886999a5194ff8250a3e",
  "run_id": "dry_run-A-002-C1-r1",
  "scorer_hash": "899621d29269ee74d87e2bb9682143405b2e3182268b5fbc8de49ba0942c9c87",
  "task_id": "A-002",
  "task_set_hash": "eddd68f8f29f0aa215d31b3b2a399ad8c7aa00812303ec82ce7a8a2111ab2536",
  "task_success": false,
  "task_version": "1.1.0",
  "token_source": "provider_usage_field",
  "tool_calls": 3,
  "total_tokens": 77471,
  "workload": "A"
}
