{
  "answer_key_hash": "ef02357796fdcd57008e59eed61f1b17577d471968e60b2750df43667a1c000f",
  "blind_treatment_id": "Treatment D",
  "cache_state": "cold",
  "condition": "C3",
  "config_hash": "9429e56f6e83167d90aea5794c5e37dfc7641fd281af306831931de3f35fe6c1",
  "container_digest": "sha256:pending-final",
  "corpus_modified": null,
  "cost": 0.0075945,
  "dependency_manifest_sha256": "8273d0e2144011927245abc2e701f009306fbf92166df665195fe6fbf031f0a9",
  "environment_id": "lab001-env-2026-09-16",
  "escalations": 0,
  "evidence_provenance": {
    "corpus_hashes_after": "the same files, re-hashed after the attempt; a difference fails it",
    "corpus_hashes_before": "sha256 of every corpus file, taken before the attempt ran",
    "document_incident_ids": "every INC-nnnn-nnn catalogued in the frozen document"
  },
  "failure_reason": "unparseable_output",
  "image_content_sha256": "88ece1882d1c7ef629c404fe3f1bade4f93eff55b47cbb22a6bd0ccaa70be5b2",
  "input_tokens": 48610,
  "latency_ms": 0,
  "methodology_version": "1.1.0",
  "model": "deepseek-flash",
  "model_calls": 1,
  "model_version": "deepseek-flash-2026-09",
  "notes": null,
  "outcome": "FAIL_QUALITY",
  "output_tokens": 505,
  "pricing_snapshot_id": "PS-2026-09-16",
  "prompt_hash": "179f9a4bb932096394af68a134e3d4091ab877dfb0ad071a095337a211cc1309",
  "provider": "deepseek",
  "quality_judged_before_cost": true,
  "quality_score": 0.0,
  "raw_evidence_path": "/lab/dryrun/out/raw/dry_run-B-002-C3-r1",
  "repetition": 1,
  "reproduces_run_id": null,
  "required_evidence_fields": [
    "corpus_hashes",
    "corpus_hashes_after",
    "corpus_hashes_before",
    "document_incident_ids"
  ],
  "retries": 0,
  "run_class": "dry_run",
  "run_config_hash": "9429e56f6e83167d90aea5794c5e37dfc7641fd281af306831931de3f35fe6c1",
  "run_id": "dry_run-B-002-C3-r1",
  "scorer_hash": "899621d29269ee74d87e2bb9682143405b2e3182268b5fbc8de49ba0942c9c87",
  "task_id": "B-002",
  "task_set_hash": "eddd68f8f29f0aa215d31b3b2a399ad8c7aa00812303ec82ce7a8a2111ab2536",
  "task_success": false,
  "task_version": "1.1.0",
  "token_source": "provider_usage_field",
  "tool_calls": 0,
  "total_tokens": 49115,
  "workload": "B"
}
